N;Clasificacion;Tipo;Categoria;Denominacion;Direccion;Direccion_detalles;CP;Municipio;Provincia;Otra_demarcacion_geografica;Latitud;Longitud;Poblacion_destinataria;Poblacion;Diana_1;Diana_2;Diana_3;Descripcion;Plazas;Acceso;Requisitos_acceso;Vinculacion;Aportacion_usuario
56;Protocolos y programas;Otras prestaciones y programas;Auxiliar;Cuidarse para cuidar;No se geolocaliza;;;;Araba;;;;Familias cuidadoras de personas mayores dependientes.;Adultos;Dependencia;;;Programa de apoyo a la red natural en zona rural. Incluye grupos de ayuda mutua, formación específica y de atención psicológica familiar en el domicilio. Prestado por Servicios Sociales de Base.;;Con derivación;Tener a su  cargo una persona mayor dependiente y que ésta esté empadronada en la zona rural del Territorio Histórico de Álava.;Temporal;Gratuito;
57;Residencial;Convalecencia sociosanitaria - URSS;Estructural;Unidad Residencial Sociosanitaria (URSS);Alto del Prado 10;;01007;Vitoria -Gasteiz;Araba;;42.8376629;-2.6920076;Cuidados al final de la vida. Convalecencia tras ingreso hospitalario. Trastorno conductual. Personas con alta hospitalaria que no pueden regresar a domicilio por problemas sociales. Personas con enfermedad infecto-contagiosa que precisan medidas especiales pero sin ingreso hospitalario.;Adultos;Población general;;;Recurso asistencial temporal que proporciona las prestaciones necesarias (sociales y sanitarias) a personas con necesidad intensa de cuidados.;25;Con derivación;Empadronamiento en el Territorio Histórico de Álava.  Tener más de 18 años. Ser beneficiario de servicio público vasco de salud u otro que asuma los gastos correspondientes. Informe favorable de COVA. Tener uno de los perfiles definidos en Decreto Foral 32/2015.;Temporal;Copago;
59;Protocolos y programas;Programa de atención temprana;Funcional;Programa de atención temprana de Araba;Escultor Isaac Diez s/n;;01007;Vitoria-Gasteiz;Araba;;42.837958;-2.6791979;Menores de 6 años y familias.;Menores;Necesidades especiales;;;Potenciar capacidades y bienestar tendentes a lograr autonomía e integración a través de actividades de estimulación global, fisioterapia, logopedia, musicoterapia.;;Con derivación;Tener menos de 6 años, padecer un trastorno del desarrollo y/o riesgo de padecerlo, y contar con un Informe técnico.;Ambulatoria;Gratuito;
60;Protocolos y programas;Programa de apoyo especializado;Funcional;Autonomía Personal;Pedro Asúa s/n.;;01008;Vitoria-Gasteiz;Araba;;42.8463479;-2.6909153;Presonas con discapacidad motórica grave. Discapacidad Mínima 65% sin discapacidad intelectual ni enfermedad mental.;Adultos;Discapacidad;Dependencia;Necesidades especiales;Terapia ocupacional, comunicación y habilitación social, rehabilitación cognitiva tendente a la autonomía e integración.;30;Con derivación;Tener una discapacidad física reconocida.;Ambulatoria;Copago;
61;Ambulatorio;Centro de día;Funcional;Centro de Día Etxebidea;Malizhaeza s/n;;01195;Armentia;Araba;;42.82754490000001;-2.6985115;Personas con discapacidad intelectual profunda. ;Adultos;Discapacidad;;;Atención asistencial y terapeútica diurna.;40;Con derivación;Empadronamiento Territorio Histórico de Álava, tner una dependencia de grado 3, Programa Individual de Atención (PIA) reconocido, e informe técnico favorable;Permanente;Copago;
62;Ambulatorio;Centro de día;Funcional;Centro de Día Ehari;Sierra de Urbasa 5-7;;01010;Vitoria-Gasteiz;Araba;;42.8596209;-2.6990767;Personas con discapacidad física grave neuromotora y del aparato locomotor, sin trastorno psiquico grave. ;Adultos;Discapacidad;;;Rehabilitación de la función mental superior, entrenamiento actividades para la vida, terapia ocupacional y actividades formativas.;25;Con derivación;Tener grado de dependencia 3, estar empadronado en el Territorio Histórico de Álava, tener el Programa Individual de Atención (PIA), e informe técnico favorable;Permanente;Copago;
63;Ambulatorio;Otras prestaciones;Funcional;Atención diurna en residencia Goizalde;Paseo Fray Francisco 20;;01007;Vitoria-Gasteiz;Araba;;42.8410304;-2.6824739;Personas con discapacidad física grave;Adultos;Discapacidad;;;Atención y cuidados residenciales (incluido transporte) en horario diurno.;6;Con derivación;Tener grado de dependencia reconocido, estar empadronado en el Territorio Histórico de Álava, tener el Programa Individual de Atención (PIA), e informe técnico favorable;Permanente;Copago;
64;Ambulatorio;Centro de día;Funcional;Centro de Día Landaverde;Landaberde, 3;;01010;Vitoria-Gasteiz;Araba;;42.86499;-2.70215;Personas con trastorno del espectro autista;Adultos;Discapacidad;;;Conservación y potenciación de habilidades, formación en aptitudes y competencias;25;Con derivación;Tener grado de dependencia reconocido, estar empadronado en el Territorio Histórico de Álava, tener el Programa Individual de Atención (PIA), e informe técnico favorable;Permanente;Copago;
65;Ambulatorio;Inserción laboral sociosanitaria;Auxiliar;Centro ocupacional Salburua;Andalucía 9;;01003;Vitoria-Gasteiz;Araba;;42.849111;-2.658709;Personas con discapacidad Intelectual que no pueden acceder a empleo y se benfician de actividades ocupacionales.;Adultos;Discapacidad;;;Programa de adiestramiento de funciones y habilidades. Programa de preparación al empleo, Servicio Pedagógico, psicológico y Trabajador Social.;40;Con derivación;Tener grado de dependencia reconocido, estar empadronado en el Territorio Histórico de Álava, tener el Programa Individual de Atención (PIA), e informe técnico favorable;Permanente;Gratuito;
66;Ambulatorio;Inserción laboral sociosanitaria;Auxiliar;Centro ocupacional Lakua;Martín Susaeta 6;;01010;Vitoria-Gasteiz;Araba;;42.8574616;-2.6960942;Personas con discapacidad Intelectual que no pueden acceder a empleo y se benfician de actividades ocupacionales.;Adultos;Discapacidad;;;Programa de adiestramiento de funciones y habilidades. Programa de preparación al empleo, Servicio Pedagógico, psicológico y Trabajador Social.;56;Con derivación;Tener grado de dependencia reconocido, estar empadronado en el Territorio Histórico de Álava, tener el Programa Individual de Atención (PIA), e informe técnico favorable;Permanente;Gratuito;
67;Ambulatorio;Inserción laboral sociosanitaria;Auxiliar;Centro ocupacional Arriaga;José M. Oz. De Mendivil 2;;01010;Vitoria-Gasteiz;Araba;;42.8563356;-2.7033575;Personas con discapacidad Intelectual que no pueden acceder a empleo y se benfician de actividades ocupacionales.;Adultos;Discapacidad;;;Programa de adiestramiento de funciones y habilidades. Programa de preparación al empleo, Servicio Pedagógico, psicológico y Trabajador Social.;56;Con derivación;Tener grado de dependencia reconocido, estar empadronado en el Territorio Histórico de Álava, tener el Programa Individual de Atención (PIA), e informe técnico favorable;Permanente;Gratuito;
68;Ambulatorio;Inserción laboral sociosanitaria;Auxiliar;Centro ocupacional Adurza;Txalaparta s/n;;01006;Vitoria-Gasteiz;Araba;;42.8372454;-2.6651672;Personas con discapacidad Intelectual que no pueden acceder a empleo y se benfician de actividades ocupacionales.;Adultos;Discapacidad;;;Programa de adiestramiento de funciones y habilidades. Programa de preparación al empleo, Servicio Pedagógico, psicológico y Trabajador Social.;40;Con derivación;Tener grado de dependencia reconocido, estar empadronado en el Territorio Histórico de Álava, tener el Programa Individual de Atención (PIA), e informe técnico favorable;Permanente;Gratuito;
69;Ambulatorio;Inserción laboral sociosanitaria;Auxiliar;Centro ocupacional Ariznavarra;Castillo de Quejana s/n;;01007;Vitoria-Gasteiz;Araba;;42.8412423;-2.6904128;Personas con discapacidad Intelectual que no pueden acceder a empleo y se benfician de actividades ocupacionales.;Adultos;Discapacidad;;;Programa de adiestramiento de funciones y habilidades. Programa de preparación al empleo, Servicio Pedagógico, psicológico y Trabajador Social.;40;Con derivación;Tener grado de dependencia reconocido, estar empadronado en el Territorio Histórico de Álava, tener el Programa Individual de Atención (PIA), e informe técnico favorable;Permanente;Gratuito;
70;Ambulatorio;Inserción laboral sociosanitaria;Auxiliar;Centro ocupacional Helios;Anglo Vasco 5;;01002;Vitoria-Gasteiz;Araba;;42.8518577;-2.665447700000001;Personas con discapacidad Intelectual que no pueden acceder a empleo y se benfician de actividades ocupacionales.;Adultos;Discapacidad;;;Programa de adiestramiento de funciones y habilidades. Programa de preparación al empleo, Servicio Pedagógico, psicológico y Trabajador Social.;40;Con derivación;Tener grado de dependencia reconocido, estar empadronado en el Territorio Histórico de Álava, tener el Programa Individual de Atención (PIA), e informe técnico favorable;Permanente;Gratuito;
71;Ambulatorio;Inserción laboral sociosanitaria;Auxiliar;Centro ocupacional Arbulo;Carretera de Irún km. 0;;01192;Arbulo;Araba;;42.8746084;-2.566925;Personas con discapacidad Intelectual que no pueden acceder a empleo y se benfician de actividades ocupacionales.;Adultos;Discapacidad;;;Programa de adiestramiento de funciones y habilidades. Programa de preparación al empleo, Servicio Pedagógico, psicológico y Trabajador Social.;8;Con derivación;Tener grado de dependencia reconocido, estar empadronado en el Territorio Histórico de Álava, tener el Programa Individual de Atención (PIA), e informe técnico favorable;Permanente;Gratuito;
72;Ambulatorio;Inserción laboral sociosanitaria;Auxiliar;Centro ocupacional Kimu;Camino de Santa Lucía s/n.;;01320;Oyón;Araba;;42.4973894;-2.4328977;Personas con discapacidad Intelectual que no pueden acceder a empleo y se benfician de actividades ocupacionales.;Adultos;Discapacidad;;;Programa de adiestramiento de funciones y habilidades. Programa de preparación al empleo, Servicio Pedagógico, psicológico y Trabajador Social.;19;Con derivación;Tener grado de dependencia reconocido, estar empadronado en el Territorio Histórico de Álava, tener el Programa Individual de Atención (PIA), e informe técnico favorable;Permanente;Gratuito;
73;Ambulatorio;Inserción laboral sociosanitaria;Auxiliar;Centro ocupacional Lantze;Barrio de Lateorro sn.;;01400;Llodio-Laudio;Araba;;43.1434506;-2.9579897;Personas con discapacidad Intelectual que no pueden acceder a empleo y se benfician de actividades ocupacionales.;Adultos;Discapacidad;;;Programa de adiestramiento de funciones y habilidades. Programa de preparación al empleo, Servicio Pedagógico, psicológico y Trabajador Social.;50;Con derivación;Tener grado de dependencia reconocido, estar empadronado en el Territorio Histórico de Álava, tener el Programa Individual de Atención (PIA), e informe técnico favorable;Permanente;Gratuito;
74;Ambulatorio;Centro de día;Funcional;Centro Ocupacional Puerto Rico;Puerto Rico 6;;01012;Vitoria-Gasteiz;Araba;;42.8573833;-2.6798158;Personas con discapacidad Intelectual que no pueden acceder a empleo y se benfician de actividades ocupacionales.;Adultos;Discapacidad;;;Programa de adiestramiento de funciones y habilidades. Programa de preparación al empleo, Servicio Pedagógico, psicológico y Trabajador Social.;50;Con derivación;Tener grado de dependencia reconocido, estar empadronado en el Territorio Histórico de Álava, tener el Programa Individual de Atención (PIA), e informe técnico favorable;Permanente;Gratuito;
75;Residencial;Residencia;Estructural;Residencia Etxebidea;Malizhaeza s/n.;;01195;Vitoria-Gasteiz;Araba;;42.82754490000001;-2.6985115;Personas con discapacidad Intelectual con necesidad de apoyos generalizados.;Adultos;Discapacidad;;;Recursos residenciales, atención sanitaria, rehabilitación, modificación de hábitos de conducta, y  programa de adiestramiento. ;75;Con derivación;Tener grado de dependencia 3, estar empadronado en el Territorio Histórico de Álava, tener el Programa Individual de Atención (PIA), e informe técnico favorable.;Permanente;Copago;
76;Residencial;Viviendas con apoyos;Funcional;Residencia Basoa;Basoa 9;;01012;Vitoria-Gasteiz;Araba;;42.85475599999999;-2.677785;Persocnas con discapacidad Intelectual;Adultos;Discapacidad;;;Recursos residenciales con apoyo técnico dirigido a la promoción e integración social y a potenciar el autocuidado. ;12;Con derivación;Tener reconocida una discapacidad intelectual, estar empadronado en el Territorio Histórico de Álava, tener el Programa Individual de Atención (PIA), e informe técnico favorable;Permanente;Copago;
77;Residencial;Viviendas con apoyos;Funcional;Residencia Portal de Castilla;Portal de Castilla 118-120;;01007;Vitoria-Gasteiz;Araba;;42.8388493;-2.6949464;Persocnas con discapacidad Intelectual;Adultos;Discapacidad;;;Recursos residenciales con apoyo técnico dirigido a la promoción e integración social y a potenciar el autocuidado. ;12;Con derivación;Tener reconocida una discapacidad intelectual, estar empadronado en el Territorio Histórico de Álava, tener el Programa Individual de Atención (PIA), e informe técnico favorable;Permanente;Copago;
78;Residencial;Viviendas con apoyos;Funcional;Residencia Zaldiaran;Oyón 51;;01015;Vitoria-Gasteiz;Araba;;42.8389326;-2.7104461;Persocnas con discapacidad Intelectual;Adultos;Discapacidad;;;Recursos residenciales con apoyo técnico dirigido a la promoción e integración social y a potenciar el autocuidado. ;9;Con derivación;Tener reconocida una discapacidad intelectual, estar empadronado en el Territorio Histórico de Álava, tener el Programa Individual de Atención (PIA), e informe técnico favorable;Permanente;Copago;
79;Residencial;Residencia;Estructural;Residencia Goizalde;Paseo Fray Francisco 20;;01007;Vitoria-Gasteiz;Araba;;42.8410304;-2.6824739;Personas con discapacidad física grave;Adultos;Discapacidad;;;Recurso residencial con atención social, enfermería, tiempo libre e inserción social.;27;Con derivación;Tener reconocida discapacidad física grave, estar empadronado en el Territorio Histórico de Álava, tener el Programa Individual de Atención (PIA), e informe técnico favorable;Permanente;Copago;
80;Residencial;Viviendas con apoyos;Funcional;Residencia Donostia;Donostia 74;;01010;Vitoria-Gasteiz;Araba;;42.8679858;-2.692648;Personas con discapacidad preferentemente visual;Adultos;Discapacidad;;;Recurso de promoción personal e integración social. Alojamiento y cuidados personales.;9;Con derivación;Tener reconocida discapacidad física grave, estar empadronado en el Territorio Histórico de Álava, tener el Programa Individual de Atención (PIA), e informe técnico favorable;;Copago;
81;Residencial;Viviendas con apoyos;Funcional;5 Pisos supervisados;General Álava 10;;01005;Vitoria-Gasteiz;Araba;;42.8450175;-2.6731605;Personas con discapacidad física intelectual o sensorial y dependencia para las actividades de la vida diaria. ;Adultos;Discapacidad;Dependencia;;Recurso residencial de intentisdad media.;20;Con derivación;Tener reconocida discapacidad física grave, estar empadronado en el Territorio Histórico de Álava, tener el Programa Individual de Atención (PIA), e informe técnico favorable;Permanente;Gratuito;
82;Residencial;Viviendas con apoyos;Funcional;Piso de respiro de fin de semana;No se geolocaliza;;;Vitoria-Gasteiz;Araba;;;;Personas con discapacidad física intelectual o sensorial y dependencia para las actividades de la vida diaria. ;Menores;Discapacidad;Dependencia;;Recurso de apoyo familiar para familias cuidadoras de menores con discapacidad intelectual que precisan de apoyo generalizado.;3;Sin derivación;Ser menor de 18 años;Temporal;Copago;
83;Residencial;Viviendas con apoyos;Funcional;15 Hogares de grupo;General Álava 10;;01005;Vitoria -Gasteiz;Araba;;42.8450175;-2.6731605;Personas con discapacidad física intelectual o sensorial y dependencia para las actividades de la vida diaria. ;Adultos;Discapacidad;Dependencia;;Recurso residencial de media y baja intensidad;146;Con derivación;Tener el grado de dependencia reconocido, esta empadronado Territorio Histórico de Álava, contar con Programa Individual de Atención (PIA) reconocido e informe técnico favorable;Permanente;Copago;
84;Ambulatorio;Otras prestaciones;Funcional;Atención diurna en residencias;No se geolocaliza;;;;Araba;;;;Personas mayores de 60 años con reconocimiento de dependencia;Adultos;Dependencia;;;Atención durante el día en residencias y viviendas comunitarias que no tienen centro de día, es decir, en Residencias Etxebidea y Goizalde.;23;Con derivación;Tener dependencia reconocida, tener más de 65 años. Esta empadronado en el Territorio Histórico de Álava, tener el Programa Individual de Atención (PIA) y prestar la aceptación del mismo. ;;Copago;
85;Protocolos y programas;Otras prestaciones y programas;Funcional;Prestaciones economicas para atención en residencias;No se geolocaliza;;;;Araba;;;;Familias cuidadoras de presonas mayores dependientes.;Adultos;Población general;;;Recurso de estancia temporal por especial necesidad o urgencia en residencias públicas y/o ayuda económica para estancia temporal en residencias privadas. Límite temporal máximo 45 días/año.;;Con derivación;Tener dependencia reconocida, tener más de 65 años. Esta empadronado en el Territorio Histórico de Álava, tener el Programa Individual de Atención (PIA) y prestar la aceptación del mismo. ;Temporal;Copago;
86;Ambulatorio;Inserción laboral sociosanitaria;Funcional;Empleo con apoyo (ASPASOSR-ARABAKO GORRAK);ASPASOR: Aragon kalea 11 ARABAKO GORRAK: Palencia 6;;01003;;Araba;;;;Personas con discapacidad que encuentran dificultades de inserción laboral;Adultos;Discapacidad;;;Labor de mediación y apoyo que favorezca tanto al colectivo de personas discapacitadas como a las empresas contratantes.;;Sin derivación;Según bases de la convocatoria ;Temporal;Gratuito;
87;Protocolos y programas;Otras prestaciones y programas;Auxiliar;Ayudas a la autonomía;No se geolocaliza;;;;Araba;;;;Asociaciones y/o fundaciones ;Adultos y menores;Discapacidad;;;Ayudas económicas para contribuir al desarrollo de programas y actividades dirigidas a personas con discapacidad;;Sin derivación;Según bases de la convocatoria ;Temporal;Gratuito;
88;Ambulatorio;Centro de día;Funcional;Centro de Día San Prudencio;Francia 35;;01002;Vitoria-Gasteiz;Araba;;42.8497316;-2.6693671;Personas mayores de 60 años con diverso grado de dependencia;Adultos;Dependencia;;;Recurso sociosanitario y de apoyo a las familias que ofrece durante el día atención a las necesidades personales básicas, terapéuticas y socioculturales de las personas mayores con diverso grado de dependencia.;40;Con derivación;;Permanente;Copago;
90;Protocolos y programas;Otras prestaciones y programas;Auxiliar;Programa integral de apoyo a familias cuidadoras de personas mayores;No se geolocaliza;;;Vitoria-Gasteiz;Araba;;;;Familias cuidadoras de personas mayores;Adultos;Población general;;;Programa de intervención de ámbito comunitario destinado a prestar apoyo a las familias cuidadoras: servicio de respiro y programas psicosociales.;;Con y sin derivación;Personas empadronadas en Vitoria-Gasteiz cuidadoras de personas mayores de 65 años;Temporal;Copago;
91;Protocolos y programas;Otras prestaciones y programas;Auxiliar;Asesoría psicológica en supuestos de abuso sexual;No se geolocaliza;;;Vitoria-Gasteiz;Araba;;;;Niños y niñas, adolescentes y sus familias.;Adultos y menores;Población general;;;Valoración de situaciones de abuso sexual, atención psicológica a niños y niñas y sus familias, asesoría y formación a profesionales.;;Con derivación;Niños/as y sus familias residentes en Vitoria-Gasteiz;Temporal;Gratuito;
92;Protocolos y programas;Protocolo de atención sociosanitaria;Estructural;Protocolo de colaboración y coordinación entre servicios sociales municipales y las Unidades de atención primaria de la Comarca Araba;No se geolocaliza;;;Vitoria-Gasteiz;Araba;;;;Personas y familias atendidas con necesidades sociosanitarias;Adultos y menores;Población general;Dependencia;Exclusión;Protocolo de colaboración y coordinación entre servicios sociales municipales y las unidades de atención primaria de la Comarca Araba.;;Con derivación; Personas residentes en Vitoria-Gasteiz;Permanente;Gratuito;
93;Protocolos y programas;Protocolo de atención sociosanitaria;Estructural;Protocolo de colaboración y coordinación entre servicios sociales municipales y la red de salud mental de Araba y el Servicio de Psiquiatría del HUA Araba;No se geolocaliza;;;Vitoria-Gasteiz;Araba;;;;Personas y familias atendidas con necesidades sociosanitarias y/o salud mental;Adultos y menores;;Adicciones;Exclusión;Protocolo de colaboración y coordinación entre servicios sociales municipales,  la red de salud mental de Araba y el servicio de psiquiatría del HUA Araba.;;Con derivación; Personas residentes en Vitoria-Gasteiz;Permanente;Gratuito;
94;Residencial;Otros recursos residenciales;Funcional;Centro Municipal de Acogida social. Recurso de alojamiento y convivencia, de corta ylarga estancia, destinado a PSER y familias (con hijos/as a su cargo) que se encuentran en situación de riesgo oexcklusión social y residencial;Avenida del Mediterráneo 12;;01010;Vitoria-Gasteiz;Araba;;42.8499075;-2.694009;PSER (Personas en Situación de Exclusión Residencial) y familias con hijos/as a cargo.;Adultos y menores;Exclusión;Adicciones;;Servicio de alojamiento con apoyos de media o alta intensidad dirigido a la realización de intervenciones orientadas a la inclusión social. Abierto 24 horas al día. ;67;Con derivación;Personas con edades comprendidas entre 18 y 65 años. Unidades convivenciales con niños/as que ue carecen de hogar y requieren apoyo de media o alta intensidad, y personas en tránsito. ;Temporal;Copago;
95;Residencial;Otros recursos residenciales;Funcional;ATERPE. Dispositivo de alojamiento de baja intensidad.  ;Villasuso 3;;01001;Vitoria-Gasteiz;Araba;;42.8476186;-2.6720492;PSER de 18 a 65 años. En particular personas en tránsito y personas sin  hogar.;Adultos;Exclusión;Adicciones;;Recurso de urgencia social. Dispositivo de alojamiento de baja intensidad. Ofrece alojamiento, desayuno, higiene, e intervención socioeducativa.;32;Con derivación;Personas PSER  con edades comprendidas entre 18 y 65 años que carecen de hogar y requieren apoyo de media o alta intensidad. ;Temporal;Copago;
96;Residencial;Otros recursos residenciales;Funcional;CASA ABIERTA. Recurso de alojamiento y convivencia, para Personas en Sitaución de Exclusión Residencial (PSER) en exclusión moderada. Alojamiento de larga estancia;Villasuso 3;;01001;Vitoria-Gasteiz;Araba;;42.8476186;-2.6720492;PSER de exclusión moderada, de 18 a 65 años con padrón de al menos 6 meses.;Adultos;Exclusión;Adicciones;;Recurso de alojamiento y convivencia. Alojamiento de larga estancia. Alta intensidad.;16;Con derivación;Personas PSER  con edades comprendidas entre 18 y 65 años. Padrón de al menos 6 meses. No padecer trastornos de conducta ni comportamiento que puedan perturbar, no rechazar tratamiento de enfermedad infecto-contagiosa, no padecer enfermedad que requiera hospitalización, no requerir asistencia sanitaria especializada.;Temporal;Copago;
97;Ambulatorio;Otras prestaciones;Funcional;ESTRADA. Centro de atención diurna para personas en exclusión, de baja exigencia y uso temporal;Fuente de la salud 4, bajo;;01003;Vitoria-Gasteiz;Araba;;42.841234;-2.6619702;PSER, de 18 a 65 años. Personas con conductas asociadas al consumo activo de sustancias adictivas o en periodo de abstinencia. Residentes.;Adultos;Exclusión;Adicciones;;Centro de atención diurna para personas en exclusión, de baja exigencia y uso temporal.;70;Con derivación;Personas en situación de exclusión. De 18 a 65 años, residentes. Personas con conductas asociadas al consumo activo de sustancias adictivas o en abstinencia,  que requieran apoyo para cobertura de necesidades. No padecer trastornos de conducta o comportamientos que puedan perturbar gravemente, no precisar asistencia sanitaria ni rechazar tratamiento de nefermedad infecto-contagiosa. ;Temporal;Copago;
98;Residencial;Otros recursos residenciales;Funcional;DAI: Dispositivo de alojamiento Invernal que posibilita durante los meses de mayor adversidad climatológica el acceso a los centros de alojamiento municipal de Personas sin hogar (varios centros);No se geolocaliza;;;Vitoria-Gasteiz;Araba;;;;Personas que no disponen de hogar y que pernoctan en la calle.;Adultos;Exclusión;Adicciones;;Dispositivo de alojamiento que posibilita durante los meses de mayor adversidad climatológica el acceso a los centros de alojamiento municipal de Personas sin hogar. ;;Con y sin derivación;No disponer de hogar y pernoctar en la calle;Temporal;Gratuito;
99;Residencial;Viviendas con apoyos;Funcional;Pisos Tutelados. Viviendas de carácter colectivo;No se geolocaliza;;;Vitoria-Gasteiz;Araba;;;;Personas entre 18 y 65 años. Unidades convivenciales con niños/as a su cargo. Personas con dificultad de alojamiento  o carentes de alojamiento. Residentes en Vitoria-Gasteiz con al menos 6 meses de padrón. ;Adultos y menores;Exclusión;Adicciones;;Viviendas de carácter colectivo;;Con derivación;;Permanente;Copago;
100;Residencial;Viviendas con apoyos;Funcional;BESARKADA ETXEA. Vivienda de carácter colectivo;Juntas Generales 61;;01010;Vitoria-Gasteiz;Araba;;42.866261;-2.6776062;Personas con VIH en estadío avanzado y sin apoyo familiar;Adultos;Exclusión;Adicciones;;Recurso residencial que proporciona apoyo psicosocial y posibilita el seguimiento global e integral de cada persona.;14;Con derivación;;Permanente;Copago;
102;Ambulatorio;Centro de día;;Proyecto Hombre;San Ignacio de Loyola 2;;01001;Vitoria-Gasteiz;Araba;;42.852731;-2.6715351;;Adultos;Adicciones;Adicciones;Adicciones;;;;;;;
